{"$id":"pe4-ha-runtime-credential-provisioning-closure.schema.json","$schema":"https://json-schema.org/draft/2020-12/schema","additionalProperties":false,"properties":{"acl_validation":{"const":"PASS"},"adapter_implementation":{"const":false},"atomic_replacement":{"const":"PASS"},"authentication_attempted":{"const":false},"authentication_validation":{"const":"DEFERRED_TO_ADAPTER_VALIDATION"},"baseline_commit":{"const":"d089be8e76a37084470336f1d999f1567f60d19f"},"canonical_content_validation":{"const":"PASS"},"codex_pi3_access":{"const":false},"correction_before_operator_execution":{"const":true},"correction_commit":{"const":"d089be8e76a37084470336f1d999f1567f60d19f"},"credential_hash_recorded":{"const":false},"credential_path":{"const":"/etc/hioc/credentials/home_assistant.token"},"credential_value_exposed":{"const":false},"deployment":{"const":false},"directory_policy":{"const":{"group":"jazofv1","mode":"0750","owner":"root"}},"evidence":{"const":{"codex_independent_pi3_inspection":false,"installation":{"acquisition":"LOCAL_HIDDEN_CONTROLLING_TTY_PROMPT_ONLY","approved_commit":"d089be8e76a37084470336f1d999f1567f60d19f","result":{"ACL_VALIDATION":"PASS","APPROVED_OPERATOR":"jazofv1","ATOMIC_REPLACEMENT":"PASS","CREDENTIAL_CONTENT_VALIDATION":"PASS","CREDENTIAL_PATH":"/etc/hioc/credentials/home_assistant.token","CREDENTIAL_VALUE_EXPOSED":"FALSE","DIRECTORY_OWNER_GROUP_MODE":"root:jazofv1:0750","DIRECTORY_VALIDATION":"PASS","FILE_OWNER_GROUP_MODE":"root:jazofv1:0640","FILE_VALIDATION":"PASS","GROUP_READER_VALIDATION":"PASS","HA_AUTHENTICATION_ATTEMPTED":"FALSE","INDEPENDENT_VALIDATION":"NOT_STARTED","NETWORK_CONNECTION_ATTEMPTED":"FALSE","OPERATION":"INSTALL","OPERATOR_ACTION":"PASS","RESULT":"PASS","TARGET_HOST":"nutandpihole"},"source_binding":"PASS"},"provenance":"OPERATOR_SUPPLIED","root_validation":{"approved_commit":"d089be8e76a37084470336f1d999f1567f60d19f","result":{"ACL_VALIDATION":"PASS","ANCESTOR_VALIDATION":"PASS","BOUNDED_READ_VALIDATION":"PASS","CONTENT_POLICY_VALIDATION":"PASS","CREDENTIAL_PATH":"/etc/hioc/credentials/home_assistant.token","CREDENTIAL_READABLE_BY_RUNTIME_OPERATOR":"NOT_TESTED","CREDENTIAL_VALUE_EXPOSED":"FALSE","HA_AUTHENTICATION_ATTEMPTED":"FALSE","MODE_VALIDATION":"PASS","NETWORK_CONNECTION_ATTEMPTED":"FALSE","OWNERSHIP_VALIDATION":"PASS","REGULAR_FILE_VALIDATION":"PASS","RESULT":"PASS","ROOT_INDEPENDENT_VALIDATION":"PASS","RUNTIME_OPERATOR_VALIDATION":"NOT_STARTED","VALIDATION_MODE":"ROOT_METADATA"},"source_binding":"PASS","validator_blob":"1bbe5826927b6b474db73fd2ace8a304b56dac66"},"runtime_operator_validation":{"approved_commit":"d089be8e76a37084470336f1d999f1567f60d19f","executed_as":"jazofv1","result":{"ACL_VALIDATION":"PASS","ANCESTOR_VALIDATION":"PASS","BOUNDED_READ_VALIDATION":"PASS","CONTENT_POLICY_VALIDATION":"PASS","CREDENTIAL_PATH":"/etc/hioc/credentials/home_assistant.token","CREDENTIAL_READABLE_BY_RUNTIME_OPERATOR":"TRUE","CREDENTIAL_VALUE_EXPOSED":"FALSE","HA_AUTHENTICATION_ATTEMPTED":"FALSE","MODE_VALIDATION":"PASS","NETWORK_CONNECTION_ATTEMPTED":"FALSE","OWNERSHIP_VALIDATION":"PASS","REGULAR_FILE_VALIDATION":"PASS","RESULT":"PASS","ROOT_INDEPENDENT_VALIDATION":"PASS","RUNTIME_OPERATOR_INDEPENDENT_VALIDATION":"PASS","VALIDATION_MODE":"RUNTIME_OPERATOR"},"source_binding":"PASS","validator_blob":"1bbe5826927b6b474db73fd2ace8a304b56dac66"},"source_synchronization":{"ahead":0,"behind":0,"credential_provisioned":false,"fast_forward":"PASS","head_after":"d089be8e76a37084470336f1d999f1567f60d19f","head_before":"d7aa423e2ead6e9c1266a884ab3e25e4331ebec1","independent_validation":"NOT_STARTED","origin_after":"d089be8e76a37084470336f1d999f1567f60d19f","origin_after_fetch":"d089be8e76a37084470336f1d999f1567f60d19f","result":"PASS"}}},"file_policy":{"const":{"group":"jazofv1","mode":"0640","owner":"root","regular_file":true,"single_link":true}},"group_reader_validation":{"const":"PASS"},"history_preserved":{"const":true},"home_assistant_access":{"const":false},"implementation_preparation_baseline":{"const":"d8e888023882770e2f158dc1fffebd5b354fb616"},"installation_operation":{"const":"INSTALL"},"installation_result":{"const":"PASS"},"lifecycle":{"const":{"adapter_implementation":"NOT_STARTED","governance_closure":"PASS_CLOSED","independent_validation":"PASS_CLOSED","operator_installation":"PASS_CLOSED","parent":"PASS_CLOSED","pe4":"NOT_COMPLETE","phase7a":"ACTIVE","preparation":"PASS_CLOSED","rollback":"NOT_PERFORMED"}},"mqtt":{"const":false},"network_attempted":{"const":false},"next_checkpoint":{"const":"PE-4 Home Assistant Association Adapter Implementation"},"not_proven":{"const":["HOME_ASSISTANT_CREDENTIAL_VALIDITY","REVOCATION_STATE","AUTHENTICATION_SUCCESS","WEBSOCKET_ACCESS","REGISTRY_COMMAND_SUCCESS","ASSOCIATION_ADAPTER_SUCCESS"]},"operator":{"const":"jazofv1"},"parent_checkpoint":{"const":"PE-4 Home Assistant Runtime Credential Provisioning"},"parent_checkpoint_status":{"const":"PASS_CLOSED"},"pi3_evidence_provenance":{"const":"OPERATOR_SUPPLIED"},"pi5_access":{"const":false},"preparation_commit":{"const":"afa484620d24a1d6dec2a98e7c06e613f633bfb7"},"preparation_record":{"const":{"path":"governance/pe4/pe4-ha-runtime-credential-provisioning-preparation.json","sha256":"f750dd7593179aa6597d4bbcb10d4c6c73662bda952ce86975eea776c3949713"}},"preparation_schema":{"const":{"path":"governance/pe4/pe4-ha-runtime-credential-provisioning-preparation.schema.json","sha256":"3e443dab66bba5191c209f17e354af4e40b4a695116b57e5ef7f494b45911bb8"}},"production_mutation_by_codex":{"const":false},"read_normalization":{"const":"REQUIRE_AND_REMOVE_EXACTLY_ONE_FINAL_LF_NO_TRIM"},"record_type":{"const":"PE4_HA_RUNTIME_CREDENTIAL_PROVISIONING_CLOSURE"},"rollback":{"const":"NOT_PERFORMED"},"root_validation":{"const":"PASS"},"rotation_performed":{"const":false},"runtime_operator_validation":{"const":"PASS"},"runtime_readability":{"const":true},"schema_version":{"const":"1.0"},"scope":{"const":"LOCAL_STORAGE_SECURITY_CANONICAL_CONTENT_ATOMIC_INSTALL_AND_ACTUAL_RUNTIME_READABILITY_ONLY"},"source":{"const":"/home/jazofv1/hioc-release-source"},"status":{"const":"PASS_CLOSED"},"stored_representation":{"const":"TOKEN_PLUS_EXACTLY_ONE_FINAL_LF"},"target":{"const":"PI3 NUT&PIHOLE"},"target_host":{"const":"nutandpihole"},"tools":{"const":{"provision":{"git_blob":"1eaa8ae508c26f5546bb80ca68393e318b481412","path":"tools/hioc-pe4-ha-runtime-credential-provision.py","sha256":"19c5625d6921ee952f70662346700e53d341d64e8f4f918a59f646cff0e27d45"},"validate":{"git_blob":"1bbe5826927b6b474db73fd2ace8a304b56dac66","path":"tools/hioc-pe4-ha-runtime-credential-validate.py","sha256":"f9ce04a51a5bf07cb841bf0d18ea7ac531e6dc6480534a1f6438c47ec8601aaa"}}}},"required":["acl_validation","adapter_implementation","atomic_replacement","authentication_attempted","authentication_validation","baseline_commit","canonical_content_validation","codex_pi3_access","correction_before_operator_execution","correction_commit","credential_hash_recorded","credential_path","credential_value_exposed","deployment","directory_policy","evidence","file_policy","group_reader_validation","history_preserved","home_assistant_access","implementation_preparation_baseline","installation_operation","installation_result","lifecycle","mqtt","network_attempted","next_checkpoint","not_proven","operator","parent_checkpoint","parent_checkpoint_status","pi3_evidence_provenance","pi5_access","preparation_commit","preparation_record","preparation_schema","production_mutation_by_codex","read_normalization","record_type","rollback","root_validation","rotation_performed","runtime_operator_validation","runtime_readability","schema_version","scope","source","status","stored_representation","target","target_host","tools"],"title":"PE-4 Home Assistant Runtime Credential Provisioning Closure","type":"object"}
