{"acl_validation":"PASS","adapter_implementation":false,"atomic_replacement":"PASS","authentication_attempted":false,"authentication_validation":"DEFERRED_TO_ADAPTER_VALIDATION","baseline_commit":"d089be8e76a37084470336f1d999f1567f60d19f","canonical_content_validation":"PASS","codex_pi3_access":false,"correction_before_operator_execution":true,"correction_commit":"d089be8e76a37084470336f1d999f1567f60d19f","credential_hash_recorded":false,"credential_path":"/etc/hioc/credentials/home_assistant.token","credential_value_exposed":false,"deployment":false,"directory_policy":{"group":"jazofv1","mode":"0750","owner":"root"},"evidence":{"codex_independent_pi3_inspection":false,"installation":{"acquisition":"LOCAL_HIDDEN_CONTROLLING_TTY_PROMPT_ONLY","approved_commit":"d089be8e76a37084470336f1d999f1567f60d19f","result":{"ACL_VALIDATION":"PASS","APPROVED_OPERATOR":"jazofv1","ATOMIC_REPLACEMENT":"PASS","CREDENTIAL_CONTENT_VALIDATION":"PASS","CREDENTIAL_PATH":"/etc/hioc/credentials/home_assistant.token","CREDENTIAL_VALUE_EXPOSED":"FALSE","DIRECTORY_OWNER_GROUP_MODE":"root:jazofv1:0750","DIRECTORY_VALIDATION":"PASS","FILE_OWNER_GROUP_MODE":"root:jazofv1:0640","FILE_VALIDATION":"PASS","GROUP_READER_VALIDATION":"PASS","HA_AUTHENTICATION_ATTEMPTED":"FALSE","INDEPENDENT_VALIDATION":"NOT_STARTED","NETWORK_CONNECTION_ATTEMPTED":"FALSE","OPERATION":"INSTALL","OPERATOR_ACTION":"PASS","RESULT":"PASS","TARGET_HOST":"nutandpihole"},"source_binding":"PASS"},"provenance":"OPERATOR_SUPPLIED","root_validation":{"approved_commit":"d089be8e76a37084470336f1d999f1567f60d19f","result":{"ACL_VALIDATION":"PASS","ANCESTOR_VALIDATION":"PASS","BOUNDED_READ_VALIDATION":"PASS","CONTENT_POLICY_VALIDATION":"PASS","CREDENTIAL_PATH":"/etc/hioc/credentials/home_assistant.token","CREDENTIAL_READABLE_BY_RUNTIME_OPERATOR":"NOT_TESTED","CREDENTIAL_VALUE_EXPOSED":"FALSE","HA_AUTHENTICATION_ATTEMPTED":"FALSE","MODE_VALIDATION":"PASS","NETWORK_CONNECTION_ATTEMPTED":"FALSE","OWNERSHIP_VALIDATION":"PASS","REGULAR_FILE_VALIDATION":"PASS","RESULT":"PASS","ROOT_INDEPENDENT_VALIDATION":"PASS","RUNTIME_OPERATOR_VALIDATION":"NOT_STARTED","VALIDATION_MODE":"ROOT_METADATA"},"source_binding":"PASS","validator_blob":"1bbe5826927b6b474db73fd2ace8a304b56dac66"},"runtime_operator_validation":{"approved_commit":"d089be8e76a37084470336f1d999f1567f60d19f","executed_as":"jazofv1","result":{"ACL_VALIDATION":"PASS","ANCESTOR_VALIDATION":"PASS","BOUNDED_READ_VALIDATION":"PASS","CONTENT_POLICY_VALIDATION":"PASS","CREDENTIAL_PATH":"/etc/hioc/credentials/home_assistant.token","CREDENTIAL_READABLE_BY_RUNTIME_OPERATOR":"TRUE","CREDENTIAL_VALUE_EXPOSED":"FALSE","HA_AUTHENTICATION_ATTEMPTED":"FALSE","MODE_VALIDATION":"PASS","NETWORK_CONNECTION_ATTEMPTED":"FALSE","OWNERSHIP_VALIDATION":"PASS","REGULAR_FILE_VALIDATION":"PASS","RESULT":"PASS","ROOT_INDEPENDENT_VALIDATION":"PASS","RUNTIME_OPERATOR_INDEPENDENT_VALIDATION":"PASS","VALIDATION_MODE":"RUNTIME_OPERATOR"},"source_binding":"PASS","validator_blob":"1bbe5826927b6b474db73fd2ace8a304b56dac66"},"source_synchronization":{"ahead":0,"behind":0,"credential_provisioned":false,"fast_forward":"PASS","head_after":"d089be8e76a37084470336f1d999f1567f60d19f","head_before":"d7aa423e2ead6e9c1266a884ab3e25e4331ebec1","independent_validation":"NOT_STARTED","origin_after":"d089be8e76a37084470336f1d999f1567f60d19f","origin_after_fetch":"d089be8e76a37084470336f1d999f1567f60d19f","result":"PASS"}},"file_policy":{"group":"jazofv1","mode":"0640","owner":"root","regular_file":true,"single_link":true},"group_reader_validation":"PASS","history_preserved":true,"home_assistant_access":false,"implementation_preparation_baseline":"d8e888023882770e2f158dc1fffebd5b354fb616","installation_operation":"INSTALL","installation_result":"PASS","lifecycle":{"adapter_implementation":"NOT_STARTED","governance_closure":"PASS_CLOSED","independent_validation":"PASS_CLOSED","operator_installation":"PASS_CLOSED","parent":"PASS_CLOSED","pe4":"NOT_COMPLETE","phase7a":"ACTIVE","preparation":"PASS_CLOSED","rollback":"NOT_PERFORMED"},"mqtt":false,"network_attempted":false,"next_checkpoint":"PE-4 Home Assistant Association Adapter Implementation","not_proven":["HOME_ASSISTANT_CREDENTIAL_VALIDITY","REVOCATION_STATE","AUTHENTICATION_SUCCESS","WEBSOCKET_ACCESS","REGISTRY_COMMAND_SUCCESS","ASSOCIATION_ADAPTER_SUCCESS"],"operator":"jazofv1","parent_checkpoint":"PE-4 Home Assistant Runtime Credential Provisioning","parent_checkpoint_status":"PASS_CLOSED","pi3_evidence_provenance":"OPERATOR_SUPPLIED","pi5_access":false,"preparation_commit":"afa484620d24a1d6dec2a98e7c06e613f633bfb7","preparation_record":{"path":"governance/pe4/pe4-ha-runtime-credential-provisioning-preparation.json","sha256":"f750dd7593179aa6597d4bbcb10d4c6c73662bda952ce86975eea776c3949713"},"preparation_schema":{"path":"governance/pe4/pe4-ha-runtime-credential-provisioning-preparation.schema.json","sha256":"3e443dab66bba5191c209f17e354af4e40b4a695116b57e5ef7f494b45911bb8"},"production_mutation_by_codex":false,"read_normalization":"REQUIRE_AND_REMOVE_EXACTLY_ONE_FINAL_LF_NO_TRIM","record_type":"PE4_HA_RUNTIME_CREDENTIAL_PROVISIONING_CLOSURE","rollback":"NOT_PERFORMED","root_validation":"PASS","rotation_performed":false,"runtime_operator_validation":"PASS","runtime_readability":true,"schema_version":"1.0","scope":"LOCAL_STORAGE_SECURITY_CANONICAL_CONTENT_ATOMIC_INSTALL_AND_ACTUAL_RUNTIME_READABILITY_ONLY","source":"/home/jazofv1/hioc-release-source","status":"PASS_CLOSED","stored_representation":"TOKEN_PLUS_EXACTLY_ONE_FINAL_LF","target":"PI3 NUT&PIHOLE","target_host":"nutandpihole","tools":{"provision":{"git_blob":"1eaa8ae508c26f5546bb80ca68393e318b481412","path":"tools/hioc-pe4-ha-runtime-credential-provision.py","sha256":"19c5625d6921ee952f70662346700e53d341d64e8f4f918a59f646cff0e27d45"},"validate":{"git_blob":"1bbe5826927b6b474db73fd2ace8a304b56dac66","path":"tools/hioc-pe4-ha-runtime-credential-validate.py","sha256":"f9ce04a51a5bf07cb841bf0d18ea7ac531e6dc6480534a1f6438c47ec8601aaa"}}}
